,0
0,#5Nov  | Benjamin Netanyahu regresará al poder en lo que promete ser uno de los gobiernos más derechistas en la historia de Israel
1,"El aterrador fascismo,racismo y sionismo encarnado en un solo demonio, Benjamin Netanyahu:

""Golpéenlos, no una vez, sino repetidamente golpéenlos hasta que les duela tanto que sea insoportable el dolor"""
2,"Benjamin Netanyahu: “Beat them up, not once but repeatedly beat them so it hurts so badly until it’s unbearable.” 
#IsraelElectsRacists"
3,"Benjamin Netanyahu: “Beat them up, not once but repeatedly beat them so it hurts so badly until it’s unbearable.” 
#IsraelElectsRacists"
4,"Benjamin Netanyahu: “Beat them up, not once but repeatedly beat them so it hurts so badly until it’s unbearable.”"
5,Not only Israeli’s The Indians want Benjamin Netanyahu
6,"Grande 
@netanyahu
, vuelve la esperanza al mundo !!!! 

 “Benjamin Netanyahu gana las elecciones y regresará al poder en Israel”"
7,"WHAT WILL BENJAMIN DO: Benjamin Netanyahu expected return as Israel's PM puts him against real TOUGH decisions to make, known for his good relations with Putin, Netanyahu will have to choose to keep relations friendly or further anger Russia, as 

1/"
8,Fomer Israeli prime minister Benjamin Netanyahu appears poised to return to power.
9,Israël: nette victoire de Benjamin Netanyahu aux élections législatives
10,"When you look at who he’s allied with Benjamin #Netanyahu looks like a m... https://youtu.be/XSoJnrja-ik via 
@YouTube"
11,"""Regardless of whether they are centre-left or far-right. In both cases, it's the same."" 

Palestinian ambassador to the UK, 
@hzomlot
, comments on Israel's elections which saw a triumph of a far-right coalition led by Benjamin Netanyahu"
12,"Benjamin Netanyahu: “Beat them up, not once but repeatedly beat them so it hurts so badly until it’s unbearable.” 

#IsraelElectsRacists #ThisIsIsrael #ApartheidIsrael #ApartheidPalestine #FreePalestine  #EndIsraeliApartheid #EndIsraelImpunity

#Jerusalem #Palestine"
13,"Pfeffer: Bibi: The Turbulent Life and Times of Benjamin Netanyahu G2YPPIQ

https://amazon.nl/dp/178738327X?tag=sinonl1101-21…"
14,Benjamin Netanyahu deve aproveitar para exigir que a Rússia não envie especialistas para ajudar no programa nuclear do Irã.
15,"Benjamin Netanyahu: “Beat them up, not once but repeatedly beat them so it hurts so badly until it’s unbearable.” 
#IsraelElectsRacists"
16,Confira no Portal Capital Liberal: Aliança de Benjamin Netanyahu volta ao poder https://buff.ly/3FNhfQG #geral
17,“Benjamin Netanyahu gana las elecciones y regresará al poder en Israel”
18,"Indian Exports are on the increase
One is the very very Indian ‘Namaste’
 
Congratulations to Benjamin Netanyahu for heading back to power as Prime Minister of Israel. There is a natural chemistry between the two Prime Ministers Modiji and Netanyahu."
19,"Félicitations et joyeux anniversaire à l'épouse du premier ministre M. Benjamin Netanyahu, Sarah NetanYahu, fête son 64ème anniversaire née le 5/11/1958, beaucoup d'amour de la part de millions de citoyens d'Israël santé et longévité,"
20,"Félicitations et joyeux anniversaire à l'épouse du premier ministre M. Benjamin Netanyahu, Sarah NetanYahu, fête son 64ème anniversaire née le 5/11/1958, beaucoup d'amour de la part de millions de citoyens d'Israël santé et longévité,"
21,"Félicitations et joyeux anniversaire à l'épouse du premier ministre M. Benjamin Netanyahu, Sarah NetanYahu, fête son 64ème anniversaire née le 5/11/1958, beaucoup d'amour de la part de millions de citoyens d'Israël santé et longévité,"
22,Ridicula essa postura. Não creio q seja do PAÍS ISRAEL. O q pensa Benjamin Netanyahu sobre isso?
23,"Benjamin Netanyahu : ""Battez-les, pas une fois mais battez-les à plusieurs reprises, tellement ça fait mal jusqu'à ce que ce soit insupportable.""
#IsraelElectsRacists"
24,"Benjamin Netanyahu: “Beat them up, not once but repeatedly beat them so it hurts so badly until it’s unbearable.” 
#IsraelElectsRacists"
25,Benjamin Netanyahu has hinted at forming a nationalist-religious government in Israel — with two ultra-Orthodox parties and Itamar Ben Gvir’s Religious Zionism.
26,"OnlinePalEng: Benjamin Netanyahu: “Beat them up, not once but repeatedly beat them so it hurts so badly until it’s unbearable.” 
#IsraelElectsRacists"
27,"Ronie Berggren: Europa behöver politiker som Benjamin Netanyahu.
”Politiker med förmågan att se de stora perspektiven, att ta avstamp i historien och sen veta vad man gör”"
28,"Podd 1716: Benjamin Netanyahu - en ledare som inspirerar, återigen Israels premiärminister http://usapol.blogspot.com/2022/11/podd-1716-benjamin-netanyahu-en-ledare.html…"
29,"QUÉ HARÁ BENJAMIN: Benjamin Netanyahu esperaba el regreso ya que el primer ministro de Israel lo pone en contra de decisiones realmente DIFÍCILES de tomar, conocido por sus buenas relaciones con Putin, Netanyahu tendrá que elegir mantener relaciones amistosas o"
30,"WHAT WILL BENJAMIN DO: Benjamin Netanyahu expected return as Israel's PM puts him against real TOUGH decisions to make, known for his good relations with Putin, Netanyahu will have to choose to keep relations friendly or"
31,"“Hay que golpearles no una vez sino reiteradamente, hasta que el dolor sea insoportable”.
- Benjamín Netanyahu"
